{
  "$schema": "https://json-schema.org/draft/2020-12/schema",
  "$id": "https://local.schemas.maple-automation.local/runtime-asset-index.schema.json",
  "title": "Maple Automation Core Runtime Asset Index",
  "description": "Hash inventory for a Runtime Bundle. Assets may remain outside the repository and are addressed through an environment variable plus a relative path.",
  "type": "object",
  "required": [
    "schema_version",
    "bundle_id",
    "release_id",
    "source_commit",
    "generated_at",
    "entries"
  ],
  "properties": {
    "schema_version": {
      "$ref": "#/$defs/version"
    },
    "bundle_id": {
      "type": "string",
      "pattern": "^[A-Za-z0-9][A-Za-z0-9._-]{2,128}$"
    },
    "release_id": {
      "type": "string",
      "pattern": "^[A-Za-z0-9][A-Za-z0-9._-]{2,128}$"
    },
    "source_commit": {
      "$ref": "#/$defs/gitCommit"
    },
    "generated_at": {
      "$ref": "#/$defs/timestamp"
    },
    "entries": {
      "type": "array",
      "minItems": 1,
      "items": {
        "$ref": "#/$defs/entry"
      }
    }
  },
  "$defs": {
    "version": {
      "type": "string",
      "pattern": "^\\d+\\.\\d+\\.\\d+$"
    },
    "sha256": {
      "type": "string",
      "pattern": "^[A-Fa-f0-9]{64}$"
    },
    "gitCommit": {
      "type": "string",
      "pattern": "^[A-Fa-f0-9]{40}$"
    },
    "portablePath": {
      "type": "string",
      "minLength": 1,
      "pattern": "^(?!/)(?![A-Za-z]:)(?!\\\\)(?!.*\\\\)(?!.*(?:^|/)\\.\\.?(?:/|$)).+$"
    },
    "rootEnv": {
      "type": "string",
      "pattern": "^[A-Z][A-Z0-9_]{2,63}$"
    },
    "timestamp": {
      "type": "string",
      "format": "date-time",
      "pattern": "^\\d{4}-\\d{2}-\\d{2}T\\d{2}:\\d{2}:\\d{2}(?:\\.\\d+)?(?:Z|[+-]\\d{2}:\\d{2})$"
    },
    "id": {
      "type": "string",
      "pattern": "^[a-z][a-z0-9._-]{2,63}$"
    },
    "entry": {
      "type": "object",
      "required": [
        "asset_id",
        "role",
        "source",
        "sha256",
        "size_bytes",
        "exists_at_generation"
      ],
      "properties": {
        "asset_id": {
          "$ref": "#/$defs/id"
        },
        "role": {
          "type": "string",
          "enum": [
            "config",
            "profile",
            "classes",
            "model",
            "dataset-split",
            "map-registry",
            "platform-graph",
            "route-manifest",
            "movement-profile",
            "receiver"
          ]
        },
        "source": {
          "type": "object",
          "required": [
            "root_env",
            "relative_path",
            "uri"
          ],
          "properties": {
            "root_env": {
              "$ref": "#/$defs/rootEnv"
            },
            "relative_path": {
              "$ref": "#/$defs/portablePath"
            },
            "uri": {
              "type": "string",
              "pattern": "^(?:external|repo)://[A-Z][A-Z0-9_]{2,63}/.+$"
            }
          },
          "additionalProperties": false
        },
        "sha256": {
          "$ref": "#/$defs/sha256"
        },
        "size_bytes": {
          "type": "integer",
          "minimum": 0
        },
        "last_write_utc": {
          "$ref": "#/$defs/timestamp"
        },
        "exists_at_generation": {
          "const": true
        }
      },
      "additionalProperties": false
    }
  },
  "additionalProperties": false
}
