{
  "bundle_id": "candidate-core-v2-20260829-shadow",
  "entries": [
    {
      "asset_id": "effective-config",
      "exists_at_generation": true,
      "last_write_utc": "2026-08-28T18:13:26Z",
      "role": "config",
      "sha256": "5d57809b0ec4f81d3a0551bcdbebd6ce296179ebdd38f87191113c0f81a017b6",
      "size_bytes": 1518,
      "source": {
        "relative_path": "configs/pilot-subject-01.resolved.json",
        "root_env": "MAPLE_CORE_ROOT",
        "uri": "repo://MAPLE_CORE_ROOT/configs/pilot-subject-01.resolved.json"
      }
    },
    {
      "asset_id": "profile",
      "exists_at_generation": true,
      "last_write_utc": "2026-08-28T18:13:26Z",
      "role": "profile",
      "sha256": "891e9ad6d3205c12ab60176e87524ba5b638554652eb45b55a6f4fe01604603f",
      "size_bytes": 347,
      "source": {
        "relative_path": "configs/pilot-subject-01.profile.json",
        "root_env": "MAPLE_CORE_ROOT",
        "uri": "repo://MAPLE_CORE_ROOT/configs/pilot-subject-01.profile.json"
      }
    },
    {
      "asset_id": "classes",
      "exists_at_generation": true,
      "last_write_utc": "2026-08-27T02:49:28Z",
      "role": "classes",
      "sha256": "07d524938046cff5c328f2b1b4c5b67847aae461172a954f6da19d6bf8954884",
      "size_bytes": 13,
      "source": {
        "relative_path": "profiles/maple_legacy_cn/models/classes_v14_mob_only.yaml",
        "root_env": "MAPLE_LEGACY_ROOT",
        "uri": "external://MAPLE_LEGACY_ROOT/profiles/maple_legacy_cn/models/classes_v14_mob_only.yaml"
      }
    },
    {
      "asset_id": "model",
      "exists_at_generation": true,
      "last_write_utc": "2026-08-28T09:25:56Z",
      "role": "model",
      "sha256": "b279fc566c3d6f1411adedafcadb33fa48d7f2ef1a5289452bf9d5c9607004b4",
      "size_bytes": 44746005,
      "source": {
        "relative_path": "mob_synth_v2/weights/best_forest_v3.onnx",
        "root_env": "MAPLE_MODEL_ROOT",
        "uri": "external://MAPLE_MODEL_ROOT/mob_synth_v2/weights/best_forest_v3.onnx"
      }
    },
    {
      "asset_id": "dataset-split",
      "exists_at_generation": true,
      "last_write_utc": "2026-08-28T09:14:10Z",
      "role": "dataset-split",
      "sha256": "6861ee5b4e8417c5e2a8f0853e270a2cb0befb67144da70d82ea874512c210c5",
      "size_bytes": 112,
      "source": {
        "relative_path": "mob_synth_v2/forest_calibration_v2/data.yaml",
        "root_env": "MAPLE_MODEL_ROOT",
        "uri": "external://MAPLE_MODEL_ROOT/mob_synth_v2/forest_calibration_v2/data.yaml"
      }
    },
    {
      "asset_id": "map-registry",
      "exists_at_generation": true,
      "last_write_utc": "2026-08-23T02:53:52Z",
      "role": "map-registry",
      "sha256": "8b01434dfcd064b96dc4a9e7a6f3d653e5837324ce2721d89185a962c7a818c2",
      "size_bytes": 1204,
      "source": {
        "relative_path": "minimaps/iv_20260823_073124/maoxiandao_map.yaml",
        "root_env": "MAPLE_LEGACY_ROOT",
        "uri": "external://MAPLE_LEGACY_ROOT/minimaps/iv_20260823_073124/maoxiandao_map.yaml"
      }
    },
    {
      "asset_id": "platform-graph",
      "exists_at_generation": true,
      "last_write_utc": "2026-08-17T15:28:26Z",
      "role": "platform-graph",
      "sha256": "834892b1d6feca47c3e79f0f2433ed032a61b45c5939a5158590072da264539c",
      "size_bytes": 8261632,
      "source": {
        "relative_path": "mapdata/maoxiandao/mxdc_maptools.sqlite3",
        "root_env": "MAPLE_LEGACY_ROOT",
        "uri": "external://MAPLE_LEGACY_ROOT/mapdata/maoxiandao/mxdc_maptools.sqlite3"
      }
    },
    {
      "asset_id": "route-manifest",
      "exists_at_generation": true,
      "last_write_utc": "2026-08-28T08:05:19Z",
      "role": "route-manifest",
      "sha256": "33f36d34ab233a86fa2cdc3227f5bd8511a7a507a9e7bc46c161d8b8738ff19f",
      "size_bytes": 26672,
      "source": {
        "relative_path": "minimaps/iv_20260823_073124/spawn_route_manifest.yaml",
        "root_env": "MAPLE_LEGACY_ROOT",
        "uri": "external://MAPLE_LEGACY_ROOT/minimaps/iv_20260823_073124/spawn_route_manifest.yaml"
      }
    },
    {
      "asset_id": "movement-profile",
      "exists_at_generation": true,
      "last_write_utc": "2026-08-28T07:07:49Z",
      "role": "movement-profile",
      "sha256": "3c7f6b209dae079973cb88b727b6a6b686bdfafc9539f64921bbe605d7568ae8",
      "size_bytes": 477,
      "source": {
        "relative_path": "profiles/movement/角色运动档案.yaml",
        "root_env": "MAPLE_LEGACY_ROOT",
        "uri": "external://MAPLE_LEGACY_ROOT/profiles/movement/角色运动档案.yaml"
      }
    },
    {
      "asset_id": "receiver",
      "exists_at_generation": true,
      "last_write_utc": "2026-08-21T18:11:38Z",
      "role": "receiver",
      "sha256": "b148643588a3a5d38f427d246ab3cea033b946edfe2852e01e416fac544865a9",
      "size_bytes": 11876,
      "source": {
        "relative_path": "receiver/input_receiver.ps1",
        "root_env": "MAPLE_LEGACY_ROOT",
        "uri": "external://MAPLE_LEGACY_ROOT/receiver/input_receiver.ps1"
      }
    }
  ],
  "generated_at": "2026-08-29T00:00:00Z",
  "release_id": "candidate-core-v2-20260829-shadow",
  "schema_version": "1.0.0",
  "source_commit": "c0ecf4d9838d3fdbecd34ba754386a2fe2979259"
}
